{"$schema":"urn:programmable:universal-admission-contract:1.0.0","authority":{"admissionDecisionGranted":false,"approvalGranted":false,"auditCompleted":false,"deploymentPerformed":false,"fundMovementAuthorized":false,"fundMovementPerformed":false,"independentAudit":false,"launchAuthorized":false,"repositoryOwnershipProven":false,"reviewCompleted":false,"safetyCertified":false,"safetyGuaranteed":false},"contractCore":{"path":"scripts/universal-admission-contract-core.mjs","sha256":"sha256:daf9ab3c0b57cfd98914c84e69e18604a8d96ee10933177e8b7d817e8b7b578e"},"contractPublisher":{"path":"scripts/universal-admission-contract.mjs","sha256":"sha256:67a5c199057df105ac511fd59bb365e694e7d098c3f0e33e207f5fcc89e58bc9"},"contractSchema":{"path":"intake/schemas/universal-admission-contract-v1.schema.json","sha256":"sha256:5c8832bc9349895d6e68b7aa9404a66c9c0b6f377365fe74b38c61307d06406c"},"deployment":{"audience":null,"enabled":false,"endpoint":null,"state":"reference-only-disabled","trustSnapshot":null},"kind":"programmable-universal-admission-contract","minimumClientProtocolVersion":"1.0.0","publicDataOnly":true,"referenceImplementation":{"artifacts":[{"path":"scripts/universal-admission-command-core.mjs","sha256":"sha256:b0d6bfa9a4c44a5885ff381d53b9c47f49f9137bd5e64d3b6734e8a7aeb510c7"},{"path":"scripts/universal-admission-core.mjs","sha256":"sha256:6d7341c0343ae490f2004b84a2378d676aa614693f441bacf15872716b1b0300"},{"path":"scripts/universal-admission-protocol-core.mjs","sha256":"sha256:69fcbe285a4ae8781cf15a133d9f5161dcbc5bc82f367b6730ce6ec3e61536f0"},{"path":"scripts/universal-admission-service-core.mjs","sha256":"sha256:c8fafd7d49819ca7055f59fe21cf443cf6449acd04e2c2ddc39cf35e154a2a42"},{"path":"scripts/universal-admission-sqlite-store.mjs","sha256":"sha256:0aed2bf8bdac877a2080b45045b8b2d78f8f1597d8a1d72e6f01b65677fc7637"},{"path":"scripts/universal-admission-sqlite.mjs","sha256":"sha256:d5867f0b2778c11fa1cdf06e581b8449bab7623d5d2c1544f821775d291c7076"},{"path":"vendor/programmable-applicant-validator/scripts/github-public-source-lossless-json.mjs","sha256":"sha256:3be87fdd35c6149dc2198d88e0199ea3b1644cb2d5e468614bcb8086b08d4758"},{"path":"vendor/programmable-applicant-validator/scripts/open-world-v2-primitives.mjs","sha256":"sha256:f0216c4f0cbfc256669ed8ebbcc61e90ab8b07d632389c203d293f496fd6394a"}],"distributed":false,"enabled":false,"kind":"node-sqlite-single-host-v1","referenceOnly":true,"topology":"single-host-single-writer"},"schemaVersion":"1.0.0","schemas":[{"id":"admission","path":"intake/schemas/universal-admission-v1.schema.json","schemaId":"urn:programmable:universal-admission:1.0.0","sha256":"sha256:2fb622de1dcfa7bee828bf584eddfdba92a4c711fe5e61b660cc7aeae6b874c6"},{"id":"command","path":"intake/schemas/universal-admission-command-v1.schema.json","schemaId":"urn:programmable:universal-admission-command:1.0.0","sha256":"sha256:158bfd8f4000ea0f2d2c7864447589da4e02d26c2e7c12a97fbe5abfc3042e4e"},{"id":"event-receipt","path":"intake/schemas/universal-admission-event-receipt-v1.schema.json","schemaId":"urn:programmable:universal-admission-event-receipt:1.0.0","sha256":"sha256:02267a6fafc8eef8933bf6021661c3bc1ae2d8553cba666d26bea6cd197cbbb8"},{"id":"runtime-policy","path":"intake/schemas/universal-admission-runtime-policy-v1.schema.json","schemaId":"urn:programmable:universal-admission-runtime-policy:1.0.0","sha256":"sha256:b6a7e90400e5da2524dce40be20b21a909307e34508efc7873c05e79f0ad9163"},{"id":"snapshot","path":"intake/schemas/universal-admission-snapshot-v1.schema.json","schemaId":"urn:programmable:universal-admission-snapshot:1.0.0","sha256":"sha256:b745247375ae60983d0cb5d142c552bffc2a59c11df8618ebcd65839af7f7289"},{"id":"transport-receipt","path":"intake/schemas/authenticated-admission-transport-receipt-v1.schema.json","schemaId":"urn:programmable:authenticated-admission-transport-receipt:1.0.0","sha256":"sha256:718c34b4d78c3f5c8de8c6a78441da636c17d403c95a42b6a1a618513cfbefe5"},{"id":"trust","path":"intake/schemas/universal-admission-trust-v1.schema.json","schemaId":"urn:programmable:universal-admission-trust:1.0.0","sha256":"sha256:eaa6246d80b8f434290118b3b5b950a128a65d12e3b91714b17e760fb583edce"},{"id":"worker-result","path":"intake/schemas/universal-admission-worker-result-v1.schema.json","schemaId":"urn:programmable:universal-admission-worker-result:1.0.0","sha256":"sha256:645f928e4ddc2519bf0ad4f82791e2d9f7c9f381d42af5bc7ab5a77c287598ff"}],"transport":{"authentication":"detached-ed25519","id":"authenticated-admission-queue-v1","operation":"enqueue"},"trustedRepository":{"defaultBranch":"main","numericId":"1320171831"}}
